{"schema_version":1,"mode":"demo","generated_utc":"2026-10-19T12:00:00Z","as_of_utc":"2026-10-19T12:00:00Z","source":"demo-generator","agents":[{"id":"observer","name":"Market Observer","role":"Reads feeds, detects regime, structure and liquidity sweeps","state":"ACTIVE","task":"Scanning 4 symbols x 3 timeframes","uptime_s":266400,"last_heartbeat_utc":"2026-10-19T11:59:57Z","metrics":[{"label":"Symbols watched","value":"4"},{"label":"Regimes","value":"XAUUSD RANGE, EURUSD RANGE, GBPUSD TREND_UP, GBPJPY TREND_UP"},{"label":"Opportunities flagged","value":"10"},{"label":"Scan interval","value":"10 s (demo)"}],"decisions":[{"id":"OBS-001","t_utc":"2026-10-19T11:57:00Z","symbol":"XAUUSD","verdict":"RANGE","summary":"XAUUSD regime RANGE; trend RANGE (HH/LL)","explanation":["6 active S/R zones","1 sweep(s) in the last 12 candles","Pivots confirmed 3 candles after they form (no look-ahead)"],"confidence":null},{"id":"OBS-002","t_utc":"2026-10-19T11:54:00Z","symbol":"EURUSD","verdict":"RANGE","summary":"EURUSD regime RANGE; trend RANGE (LH/LL)","explanation":["6 active S/R zones","4 sweep(s) in the last 12 candles","Pivots confirmed 3 candles after they form (no look-ahead)"],"confidence":null},{"id":"OBS-003","t_utc":"2026-10-19T11:51:00Z","symbol":"GBPUSD","verdict":"TREND_UP","summary":"GBPUSD regime TREND_UP; trend UP (HH/LL)","explanation":["6 active S/R zones","0 sweep(s) in the last 12 candles","Pivots confirmed 3 candles after they form (no look-ahead)"],"confidence":null},{"id":"OBS-004","t_utc":"2026-10-19T11:48:00Z","symbol":"GBPJPY","verdict":"TREND_UP","summary":"GBPJPY regime TREND_UP; trend UP (HH/HL)","explanation":["6 active S/R zones","0 sweep(s) in the last 12 candles","Pivots confirmed 3 candles after they form (no look-ahead)"],"confidence":null}],"log":[{"t_utc":"2026-10-19T11:59:40Z","level":"INFO","msg":"observer scan complete: 12 market views"},{"t_utc":"2026-10-19T11:54:40Z","level":"INFO","msg":"observer regime refresh: RANGE/RANGE/TREND_UP/TREND_UP"},{"t_utc":"2026-10-19T11:45:00Z","level":"WARN","msg":"observer GBPJPY spread above 1.35x baseline for 4 min"},{"t_utc":"2026-10-19T11:30:00Z","level":"INFO","msg":"observer pivot confirmation lag = 3 candles"}]},{"id":"analyst","name":"Signal Analyst","role":"Turns structure into BUY / SELL / WAIT candidates with explanations","state":"ACTIVE","task":"Evaluating M15 and H1 structure","uptime_s":270000,"last_heartbeat_utc":"2026-10-19T11:59:55Z","metrics":[{"label":"Signals now","value":"5 actionable / 3 WAIT"},{"label":"Validated edge","value":"none"},{"label":"Probability shown","value":"never (no validated data)"}],"decisions":[{"id":"SIG-001","t_utc":"2026-10-19T11:56:00Z","symbol":"XAUUSD","verdict":"WAIT","summary":"XAUUSD M15: WAIT","explanation":["No trigger: regime RANGE, trend RANGE, no recent sweep.","ATR(14) = 846 pips; stop distance 677 pips."],"confidence":null},{"id":"SIG-002","t_utc":"2026-10-19T11:52:00Z","symbol":"EURUSD","verdict":"BUY","summary":"EURUSD M15: BUY candidate, R:R 1.42","explanation":["Sell-side liquidity sweep 1 candle(s) ago, closed back above 1.12638.","ATR(14) = 6 pips; stop distance 5 pips.","Target at the nearest resistance zone."],"confidence":null},{"id":"SIG-003","t_utc":"2026-10-19T11:48:00Z","symbol":"GBPUSD","verdict":"BUY","summary":"GBPUSD M15: BUY candidate, R:R 1.5","explanation":["Uptrend (HH/LL) with a pullback to the 20-EMA.","ATR(14) = 9 pips; stop distance 7 pips.","No opposing zone found: target set to 1.5R."],"confidence":null},{"id":"SIG-004","t_utc":"2026-10-19T11:44:00Z","symbol":"GBPJPY","verdict":"WAIT","summary":"GBPJPY M15: WAIT","explanation":["No trigger: regime TREND_UP, trend UP, no recent sweep.","ATR(14) = 18 pips; stop distance 14 pips."],"confidence":null}],"log":[{"t_utc":"2026-10-19T11:59:20Z","level":"INFO","msg":"analyst 8 signals evaluated"},{"t_utc":"2026-10-19T11:49:20Z","level":"INFO","msg":"analyst spread gate applied to every candidate"},{"t_utc":"2026-10-19T11:35:00Z","level":"WARN","msg":"analyst no validated edge: signals are illustrative"}]},{"id":"guardian","name":"Risk Guardian","role":"Independent veto: spread gate, limits, validation status","state":"ACTIVE","task":"Gatekeeping every candidate","uptime_s":273600,"last_heartbeat_utc":"2026-10-19T11:59:53Z","metrics":[{"label":"Open paper positions","value":"2 / 3"},{"label":"Drawdown","value":"4.98% of 8%"},{"label":"Risk per trade","value":"0.25%"},{"label":"Trading","value":"DISABLED (research build)"}],"decisions":[{"id":"RSK-001","t_utc":"2026-10-19T11:56:20Z","symbol":"XAUUSD","verdict":"VETO (research mode)","summary":"XAUUSD SELL candidate vetoed","explanation":["Validated edge: No strategy has passed FDR-controlled validation","Execution: Trading disabled in this build (research only)"],"confidence":null},{"id":"RSK-002","t_utc":"2026-10-19T11:52:20Z","symbol":"EURUSD","verdict":"VETO (research mode)","summary":"EURUSD BUY candidate vetoed","explanation":["Validated edge: No strategy has passed FDR-controlled validation","Execution: Trading disabled in this build (research only)"],"confidence":null},{"id":"RSK-003","t_utc":"2026-10-19T11:48:20Z","symbol":"EURUSD","verdict":"VETO (research mode)","summary":"EURUSD SELL candidate vetoed","explanation":["Validated edge: No strategy has passed FDR-controlled validation","Execution: Trading disabled in this build (research only)"],"confidence":null},{"id":"RSK-004","t_utc":"2026-10-19T11:44:20Z","symbol":"GBPUSD","verdict":"VETO (research mode)","summary":"GBPUSD BUY candidate vetoed","explanation":["Validated edge: No strategy has passed FDR-controlled validation","Execution: Trading disabled in this build (research only)"],"confidence":null},{"id":"RSK-005","t_utc":"2026-10-19T11:40:20Z","symbol":"GBPJPY","verdict":"VETO (research mode)","summary":"GBPJPY BUY candidate vetoed","explanation":["Validated edge: No strategy has passed FDR-controlled validation","Execution: Trading disabled in this build (research only)"],"confidence":null}],"log":[{"t_utc":"2026-10-19T11:59:30Z","level":"INFO","msg":"guardian limits OK: daily loss, drawdown, open positions"},{"t_utc":"2026-10-19T11:48:20Z","level":"WARN","msg":"guardian vetoed candidate: execution disabled"},{"t_utc":"2026-10-19T11:20:00Z","level":"INFO","msg":"guardian kill switch engaged by default"}]},{"id":"evaluator","name":"Strategy Evaluator","role":"Runs validation: day-block bootstrap, FDR, frozen test discipline","state":"IDLE","task":"Idle: waiting for the next data window","uptime_s":277200,"last_heartbeat_utc":"2026-10-19T11:59:51Z","metrics":[{"label":"Candidates","value":"144 in V7.2 family"},{"label":"Eligible","value":"0"},{"label":"FDR level q","value":"0.10"},{"label":"Frozen test","value":"not evaluated"}],"decisions":[{"id":"EVL-001","t_utc":"2026-10-19T11:00:00Z","symbol":null,"verdict":"REJECTED","summary":"S01 THREE_BAR_MOMENTUM · NORMAL · 30s · RANGE: REJECTED","explanation":["validation mean -0.128R (CI -0.289 to 0.036)","FDR-adjusted p = 0.967 (needs <= 0.10)","Test split stays frozen until a candidate is eligible"],"confidence":null},{"id":"EVL-002","t_utc":"2026-10-19T10:00:00Z","symbol":null,"verdict":"REJECTED","summary":"S02 THREE_BAR_MOMENTUM · REVERSE · 60s · TREND_UP: REJECTED","explanation":["validation mean -0.168R (CI -0.524 to 0.142)","FDR-adjusted p = 0.967 (needs <= 0.10)","Test split stays frozen until a candidate is eligible"],"confidence":null},{"id":"EVL-003","t_utc":"2026-10-19T09:00:00Z","symbol":null,"verdict":"REJECTED","summary":"S03 THREE_RED_GREEN_WICK · NORMAL · 60s · RANGE: REJECTED","explanation":["validation mean 0.085R (CI -0.115 to 0.287)","FDR-adjusted p = 0.967 (needs <= 0.10)","Test split stays frozen until a candidate is eligible"],"confidence":null},{"id":"EVL-004","t_utc":"2026-10-19T08:00:00Z","symbol":null,"verdict":"REJECTED","summary":"S04 THREE_GREEN_RED_WICK · NORMAL · 120s · VOLATILE: REJECTED","explanation":["validation mean 0.246R (CI 0.063 to 0.439)","FDR-adjusted p = 0.418 (needs <= 0.10)","Test split stays frozen until a candidate is eligible"],"confidence":null},{"id":"EVL-005","t_utc":"2026-10-19T07:00:00Z","symbol":null,"verdict":"WAIT","summary":"S05 SWEEP_RECLAIM · NORMAL · 60s · RANGE: WAIT","explanation":["validation mean -0.178R (CI -0.474 to 0.045)","FDR-adjusted p = 0.967 (needs <= 0.10)","Test split stays frozen until a candidate is eligible"],"confidence":null}],"log":[{"t_utc":"2026-10-19T11:30:00Z","level":"INFO","msg":"evaluator candidate table recomputed (day-block bootstrap, 400 resamples)"},{"t_utc":"2026-10-19T11:29:50Z","level":"INFO","msg":"evaluator BH-FDR applied over the declared family"},{"t_utc":"2026-10-19T11:00:00Z","level":"WARN","msg":"evaluator no candidate passed validation"}]},{"id":"performance","name":"Performance Analyst","role":"Tracks paper results, drawdown and cost hurdle","state":"ACTIVE","task":"Updating paper statistics","uptime_s":280800,"last_heartbeat_utc":"2026-10-19T11:59:49Z","metrics":[{"label":"Trades (paper)","value":"120"},{"label":"Mean R","value":"-0.129"},{"label":"Win rate","value":"45%"},{"label":"Profit factor","value":"0.71"}],"decisions":[{"id":"PRF-001","t_utc":"2026-10-19T11:30:00Z","symbol":null,"verdict":"REPORT","summary":"Paper results: 120 trades, mean -0.129R, win rate 45%","explanation":["profit factor 0.71, max drawdown 21.4R","Mean R is below zero: consistent with the spread/stop cost hurdle (research finding)","Scenarios are simulations, not executed trades"],"confidence":null},{"id":"PRF-002","t_utc":"2026-10-19T10:00:00Z","symbol":null,"verdict":"ALERT","summary":"Drawdown 5.0% of 8% limit","explanation":["Within limits","Risk Guardian notified"],"confidence":null}],"log":[{"t_utc":"2026-10-19T11:59:00Z","level":"INFO","msg":"performance equity curve updated"},{"t_utc":"2026-10-19T11:10:00Z","level":"INFO","msg":"performance cost hurdle: mean R below zero"}]}],"messages":[{"t_utc":"2026-10-19T11:59:15Z","from":"observer","to":"analyst","topic":"regime update"